++++++
++++++++++++++++++++++++++++++++++++
[ Info: Testing agnesi transforms
Test Passed
Test Passed
Test Passed
Rnlrzz Basis: Error During Test at /home/eng/essswb/ace-potentials-julia-1.2/ACEpotentials.jl/test/models/test_models.jl:5
  Got exception outside of a @test
  LoadError: ArgumentError: Package ACEbase not found in current path.
  - Run `import Pkg; Pkg.add("ACEbase")` to install the ACEbase package.
  Stacktrace:
    [1] macro expansion
      @ ./loading.jl:2296 [inlined]
    [2] macro expansion
      @ ./lock.jl:273 [inlined]
    [3] __require(into::Module, mod::Symbol)
      @ Base ./loading.jl:2271
    [4] #invoke_in_world#3
      @ ./essentials.jl:1089 [inlined]
    [5] invoke_in_world
      @ ./essentials.jl:1086 [inlined]
    [6] require(into::Module, mod::Symbol)
      @ Base ./loading.jl:2260
    [7] include(fname::String)
      @ Main ./sysimg.jl:38
    [8] macro expansion
      @ ~/ace-potentials-julia-1.2/ACEpotentials.jl/test/models/test_models.jl:5 [inlined]
    [9] macro expansion
      @ ~/.julia/juliaup/julia-1.11.7+0.x64.linux.gnu/share/julia/stdlib/v1.11/Test/src/Test.jl:1709 [inlined]
   [10] top-level scope
      @ ~/ace-potentials-julia-1.2/ACEpotentials.jl/test/models/test_models.jl:5
   [11] include(fname::String)
      @ Main ./sysimg.jl:38
   [12] macro expansion
      @ ~/ace-potentials-julia-1.2/ACEpotentials.jl/test/runtests.jl:6 [inlined]
   [13] macro expansion
      @ ~/.julia/juliaup/julia-1.11.7+0.x64.linux.gnu/share/julia/stdlib/v1.11/Test/src/Test.jl:1709 [inlined]
   [14] macro expansion
      @ ~/ace-potentials-julia-1.2/ACEpotentials.jl/test/runtests.jl:6 [inlined]
   [15] macro expansion
      @ ~/.julia/juliaup/julia-1.11.7+0.x64.linux.gnu/share/julia/stdlib/v1.11/Test/src/Test.jl:1709 [inlined]
   [16] top-level scope
      @ ~/ace-potentials-julia-1.2/ACEpotentials.jl/test/runtests.jl:6
  in expression starting at /home/eng/essswb/ace-potentials-julia-1.2/ACEpotentials.jl/test/models/test_Rnl.jl:10
Pair Basis: Error During Test at /home/eng/essswb/ace-potentials-julia-1.2/ACEpotentials.jl/test/models/test_models.jl:6
  Got exception outside of a @test
  LoadError: ArgumentError: Package ACEbase not found in current path.
  - Run `import Pkg; Pkg.add("ACEbase")` to install the ACEbase package.
  Stacktrace:
    [1] macro expansion
      @ ./loading.jl:2296 [inlined]
    [2] macro expansion
      @ ./lock.jl:273 [inlined]
    [3] __require(into::Module, mod::Symbol)
      @ Base ./loading.jl:2271
    [4] #invoke_in_world#3
      @ ./essentials.jl:1089 [inlined]
    [5] invoke_in_world
      @ ./essentials.jl:1086 [inlined]
    [6] require(into::Module, mod::Symbol)
      @ Base ./loading.jl:2260
    [7] include(fname::String)
      @ Main ./sysimg.jl:38
    [8] macro expansion
      @ ~/ace-potentials-julia-1.2/ACEpotentials.jl/test/models/test_models.jl:6 [inlined]
    [9] macro expansion
      @ ~/.julia/juliaup/julia-1.11.7+0.x64.linux.gnu/share/julia/stdlib/v1.11/Test/src/Test.jl:1709 [inlined]
   [10] top-level scope
      @ ~/ace-potentials-julia-1.2/ACEpotentials.jl/test/models/test_models.jl:6
   [11] include(fname::String)
      @ Main ./sysimg.jl:38
   [12] macro expansion
      @ ~/ace-potentials-julia-1.2/ACEpotentials.jl/test/runtests.jl:6 [inlined]
   [13] macro expansion
      @ ~/.julia/juliaup/julia-1.11.7+0.x64.linux.gnu/share/julia/stdlib/v1.11/Test/src/Test.jl:1709 [inlined]
   [14] macro expansion
      @ ~/ace-potentials-julia-1.2/ACEpotentials.jl/test/runtests.jl:6 [inlined]
   [15] macro expansion
      @ ~/.julia/juliaup/julia-1.11.7+0.x64.linux.gnu/share/julia/stdlib/v1.11/Test/src/Test.jl:1709 [inlined]
   [16] top-level scope
      @ ~/ace-potentials-julia-1.2/ACEpotentials.jl/test/runtests.jl:6
  in expression starting at /home/eng/essswb/ace-potentials-julia-1.2/ACEpotentials.jl/test/models/test_pair_basis.jl:8
ACE Model: Error During Test at /home/eng/essswb/ace-potentials-julia-1.2/ACEpotentials.jl/test/models/test_models.jl:7
  Got exception outside of a @test
  LoadError: ArgumentError: Package ACEbase not found in current path.
  - Run `import Pkg; Pkg.add("ACEbase")` to install the ACEbase package.
  Stacktrace:
    [1] macro expansion
      @ ./loading.jl:2296 [inlined]
    [2] macro expansion
      @ ./lock.jl:273 [inlined]
    [3] __require(into::Module, mod::Symbol)
      @ Base ./loading.jl:2271
    [4] #invoke_in_world#3
      @ ./essentials.jl:1089 [inlined]
    [5] invoke_in_world
      @ ./essentials.jl:1086 [inlined]
    [6] require(into::Module, mod::Symbol)
      @ Base ./loading.jl:2260
    [7] include(fname::String)
      @ Main ./sysimg.jl:38
    [8] macro expansion
      @ ~/ace-potentials-julia-1.2/ACEpotentials.jl/test/models/test_models.jl:7 [inlined]
    [9] macro expansion
      @ ~/.julia/juliaup/julia-1.11.7+0.x64.linux.gnu/share/julia/stdlib/v1.11/Test/src/Test.jl:1709 [inlined]
   [10] top-level scope
      @ ~/ace-potentials-julia-1.2/ACEpotentials.jl/test/models/test_models.jl:7
   [11] include(fname::String)
      @ Main ./sysimg.jl:38
   [12] macro expansion
      @ ~/ace-potentials-julia-1.2/ACEpotentials.jl/test/runtests.jl:6 [inlined]
   [13] macro expansion
      @ ~/.julia/juliaup/julia-1.11.7+0.x64.linux.gnu/share/julia/stdlib/v1.11/Test/src/Test.jl:1709 [inlined]
   [14] macro expansion
      @ ~/ace-potentials-julia-1.2/ACEpotentials.jl/test/runtests.jl:6 [inlined]
   [15] macro expansion
      @ ~/.julia/juliaup/julia-1.11.7+0.x64.linux.gnu/share/julia/stdlib/v1.11/Test/src/Test.jl:1709 [inlined]
   [16] top-level scope
      @ ~/ace-potentials-julia-1.2/ACEpotentials.jl/test/runtests.jl:6
  in expression starting at /home/eng/essswb/ace-potentials-julia-1.2/ACEpotentials.jl/test/models/test_ace.jl:7
ACE Calculator: Error During Test at /home/eng/essswb/ace-potentials-julia-1.2/ACEpotentials.jl/test/models/test_models.jl:8
  Got exception outside of a @test
  LoadError: ArgumentError: Package ACEbase not found in current path.
  - Run `import Pkg; Pkg.add("ACEbase")` to install the ACEbase package.
  Stacktrace:
    [1] macro expansion
      @ ./loading.jl:2296 [inlined]
    [2] macro expansion
      @ ./lock.jl:273 [inlined]
    [3] __require(into::Module, mod::Symbol)
      @ Base ./loading.jl:2271
    [4] #invoke_in_world#3
      @ ./essentials.jl:1089 [inlined]
    [5] invoke_in_world
      @ ./essentials.jl:1086 [inlined]
    [6] require(into::Module, mod::Symbol)
      @ Base ./loading.jl:2260
    [7] include(fname::String)
      @ Main ./sysimg.jl:38
    [8] macro expansion
      @ ~/ace-potentials-julia-1.2/ACEpotentials.jl/test/models/test_models.jl:8 [inlined]
    [9] macro expansion
      @ ~/.julia/juliaup/julia-1.11.7+0.x64.linux.gnu/share/julia/stdlib/v1.11/Test/src/Test.jl:1709 [inlined]
   [10] top-level scope
      @ ~/ace-potentials-julia-1.2/ACEpotentials.jl/test/models/test_models.jl:8
   [11] include(fname::String)
      @ Main ./sysimg.jl:38
   [12] macro expansion
      @ ~/ace-potentials-julia-1.2/ACEpotentials.jl/test/runtests.jl:6 [inlined]
   [13] macro expansion
      @ ~/.julia/juliaup/julia-1.11.7+0.x64.linux.gnu/share/julia/stdlib/v1.11/Test/src/Test.jl:1709 [inlined]
   [14] macro expansion
      @ ~/ace-potentials-julia-1.2/ACEpotentials.jl/test/runtests.jl:6 [inlined]
   [15] macro expansion
      @ ~/.julia/juliaup/julia-1.11.7+0.x64.linux.gnu/share/julia/stdlib/v1.11/Test/src/Test.jl:1709 [inlined]
   [16] top-level scope
      @ ~/ace-potentials-julia-1.2/ACEpotentials.jl/test/runtests.jl:6
  in expression starting at /home/eng/essswb/ace-potentials-julia-1.2/ACEpotentials.jl/test/models/test_calculator.jl:7
  Activating project at `~/ace-potentials-julia-1.2/ACEpotentials.jl`
Committees: Error During Test at /home/eng/essswb/ace-potentials-julia-1.2/ACEpotentials.jl/test/models/test_models.jl:9
  Got exception outside of a @test
  LoadError: ArgumentError: Package ACEbase not found in current path.
  - Run `import Pkg; Pkg.add("ACEbase")` to install the ACEbase package.
  Stacktrace:
    [1] macro expansion
      @ ./loading.jl:2296 [inlined]
    [2] macro expansion
      @ ./lock.jl:273 [inlined]
    [3] __require(into::Module, mod::Symbol)
      @ Base ./loading.jl:2271
    [4] #invoke_in_world#3
      @ ./essentials.jl:1089 [inlined]
    [5] invoke_in_world
      @ ./essentials.jl:1086 [inlined]
    [6] require(into::Module, mod::Symbol)
      @ Base ./loading.jl:2260
    [7] include(fname::String)
      @ Main ./sysimg.jl:38
    [8] macro expansion
      @ ~/ace-potentials-julia-1.2/ACEpotentials.jl/test/models/test_models.jl:9 [inlined]
    [9] macro expansion
      @ ~/.julia/juliaup/julia-1.11.7+0.x64.linux.gnu/share/julia/stdlib/v1.11/Test/src/Test.jl:1709 [inlined]
   [10] top-level scope
      @ ~/ace-potentials-julia-1.2/ACEpotentials.jl/test/models/test_models.jl:9
   [11] include(fname::String)
      @ Main ./sysimg.jl:38
   [12] macro expansion
      @ ~/ace-potentials-julia-1.2/ACEpotentials.jl/test/runtests.jl:6 [inlined]
   [13] macro expansion
      @ ~/.julia/juliaup/julia-1.11.7+0.x64.linux.gnu/share/julia/stdlib/v1.11/Test/src/Test.jl:1709 [inlined]
   [14] macro expansion
      @ ~/ace-potentials-julia-1.2/ACEpotentials.jl/test/runtests.jl:6 [inlined]
   [15] macro expansion
      @ ~/.julia/juliaup/julia-1.11.7+0.x64.linux.gnu/share/julia/stdlib/v1.11/Test/src/Test.jl:1709 [inlined]
   [16] top-level scope
      @ ~/ace-potentials-julia-1.2/ACEpotentials.jl/test/runtests.jl:6
  in expression starting at /home/eng/essswb/ace-potentials-julia-1.2/ACEpotentials.jl/test/models/test_committee.jl:5
Test silicon: Error During Test at /home/eng/essswb/ace-potentials-julia-1.2/ACEpotentials.jl/test/runtests.jl:9
  Got exception outside of a @test
  LoadError: ArgumentError: Package ACEbase not found in current path.
  - Run `import Pkg; Pkg.add("ACEbase")` to install the ACEbase package.
  Stacktrace:
    [1] macro expansion
      @ ./loading.jl:2296 [inlined]
    [2] macro expansion
      @ ./lock.jl:273 [inlined]
    [3] __require(into::Module, mod::Symbol)
      @ Base ./loading.jl:2271
    [4] #invoke_in_world#3
      @ ./essentials.jl:1089 [inlined]
    [5] invoke_in_world
      @ ./essentials.jl:1086 [inlined]
    [6] require(into::Module, mod::Symbol)
      @ Base ./loading.jl:2260
    [7] include(fname::String)
      @ Main ./sysimg.jl:38
    [8] macro expansion
      @ ~/ace-potentials-julia-1.2/ACEpotentials.jl/test/runtests.jl:9 [inlined]
    [9] macro expansion
      @ ~/.julia/juliaup/julia-1.11.7+0.x64.linux.gnu/share/julia/stdlib/v1.11/Test/src/Test.jl:1709 [inlined]
   [10] macro expansion
      @ ~/ace-potentials-julia-1.2/ACEpotentials.jl/test/runtests.jl:9 [inlined]
   [11] macro expansion
      @ ~/.julia/juliaup/julia-1.11.7+0.x64.linux.gnu/share/julia/stdlib/v1.11/Test/src/Test.jl:1709 [inlined]
   [12] top-level scope
      @ ~/ace-potentials-julia-1.2/ACEpotentials.jl/test/runtests.jl:6
  in expression starting at /home/eng/essswb/ace-potentials-julia-1.2/ACEpotentials.jl/test/test_silicon.jl:6
[ Info: Checking recompute_weights
[ Info: Assembling full weight vector.
Progress:   4%|█▌                                       |  ETA: 0:01:18Progress: 100%|█████████████████████████████████████████| Time: 0:00:03
[ Info: Assembling full weight vector.
Test Passed
[ Info: Assembling full weight vector.
Test Passed
  Activating new project at `/tmp/jl_PE5ynM1sN6`
   Resolving package versions...
    Updating `/tmp/jl_PE5ynM1sN6/Project.toml`
  [3b96b61c] + ACEpotentials v0.9.1 `~/ace-potentials-julia-1.2/ACEpotentials.jl`
    Updating `/tmp/jl_PE5ynM1sN6/Manifest.toml`
  [14bae519] + ACEbase v0.4.5
  [ad31a8ef] + ACEfit v0.2.6
  [3b96b61c] + ACEpotentials v0.9.1 `~/ace-potentials-julia-1.2/ACEpotentials.jl`
  [47edcb42] + ADTypes v1.18.0
  [621f4979] + AbstractFFTs v1.5.0
  [7d9f7c33] + Accessors v0.1.42
  [d86c1dc8] + ActiveSetPursuit v0.0.4
  [79e6a3ab] + Adapt v4.4.0
  [66dad0bd] + AliasTables v1.1.3
  [dce04be8] + ArgCheck v2.5.0
  [c7e460c6] + ArgParse v1.2.0
  [4fba245c] + ArrayInterface v7.22.0
  [a9b6321e] + Atomix v1.1.2
  [a963bdd2] + AtomsBase v0.5.2
  [f5cc8831] + AtomsBuilder v0.2.2
  [a3e0e189] + AtomsCalculators v0.2.3
  [9855a07e] + AtomsCalculatorsUtilities v0.1.8
  [13072b0f] + AxisAlgorithms v1.1.0
  [198e06fe] + BangBang v0.4.6
  [9718e550] + Baselet v0.1.1
  [6e4b80f9] + BenchmarkTools v1.6.3
  [62783981] + BitTwiddlingConvenienceFunctions v0.1.6
  [8ce10254] + Bumper v0.7.1
  [fa961155] + CEnum v0.5.0
  [2a0fbf3d] + CPUSummary v0.2.7
  [49dc2e85] + Calculus v0.5.2
  [082447d4] + ChainRules v1.72.6
  [d360d2e6] + ChainRulesCore v1.26.0
  [ae650224] + ChunkSplitters v3.1.2
  [fb6a15b2] + CloseOpenIntervals v0.1.13
  [6309b1aa] + CodecInflate64 v0.1.3
  [944b1d66] + CodecZlib v0.7.8
  [861a8166] + Combinatorics v1.0.3
  [38540f10] + CommonSolve v0.2.4
  [bbf7d656] + CommonSubexpressions v0.3.1
  [f70d9fcc] + CommonWorldInvalidations v1.0.0
  [34da2185] + Compat v4.18.1
  [a33af91c] + CompositionsBase v0.1.2
  [2569d6c7] + ConcreteStructs v0.2.3
  [187b0558] + ConstructionBase v1.6.0
  [adafc99b] + CpuId v0.3.1
  [a8cc5b0e] + Crayons v4.1.1
  [9a962f9c] + DataAPI v1.16.0
  [a93c6f00] + DataFrames v1.8.1
  [864edb3b] + DataStructures v0.19.3
  [e2d170a0] + DataValueInterfaces v1.0.0
  [244e2a9f] + DefineSingletons v0.1.2
  [163ba53b] + DiffResults v1.1.0
  [b552c78f] + DiffRules v1.15.1
  [a0c0ee7d] + DifferentiationInterface v0.7.11
  [8d63f2c5] + DispatchDoctor v0.4.26
  [ffbed154] + DocStringExtensions v0.9.5
  [7c1d4256] + DynamicPolynomials v0.6.4
  [38527215] + EmpiricalPotentials v0.2.4
  [4e289a0a] + EnumX v1.0.5
  [f151be2c] + EnzymeCore v0.8.16
  [5e107534] + EquivariantTensors v0.3.0
  [e2ba6199] + ExprTools v0.1.10
  [352459e4] + ExtXYZ v0.2.2
  [e189563c] + ExternalDocstrings v0.1.1
  [7a1cc6ca] + FFTW v1.10.0
  [9aa1b823] + FastClosures v0.3.2
  [1a297f60] + FillArrays v1.15.0
  [6a86dc24] + FiniteDiff v2.29.0
  [41a02a25] + Folds v0.2.10
⌅ [f6369f11] + ForwardDiff v0.10.39
  [d9f16b24] + Functors v0.5.2
  [0c68f7d7] + GPUArrays v11.2.6
  [46192b85] + GPUArraysCore v0.2.0
  [f0d1745a] + HalfIntegers v1.6.0
  [076d061b] + HashArrayMappedTries v0.2.0
  [3e5b6fbb] + HostCPUFeatures v0.1.17
  [50ceba7f] + HyperDualNumbers v4.0.10
  [7869d1d1] + IRTools v0.4.15
  [615f187c] + IfElse v0.1.1
  [22cec73e] + InitialValues v0.3.1
  [842dd82b] + InlineStrings v1.4.5
  [0c81fc1b] + InputBuffers v1.1.1
⌅ [a98d9a8b] + Interpolations v0.15.1
  [3587e190] + InverseFunctions v0.1.17
  [41ab1584] + InvertedIndices v1.3.1
  [92d709cd] + IrrationalConstants v0.2.6
  [42fd0dbc] + IterativeSolvers v0.9.4
  [82899510] + IteratorInterfaceExtensions v1.0.0
  [692b3bcd] + JLLWrappers v1.7.1
⌅ [682c06a0] + JSON v0.21.4
  [63c18a36] + KernelAbstractions v0.9.39
  [929cbde3] + LLVM v9.4.4
  [b964fa9f] + LaTeXStrings v1.4.0
  [10f19ff3] + LayoutPointers v0.1.17
  [0e77f7df] + LazilyInitializedFields v1.3.0
  [d3d80556] + LineSearches v7.4.0
  [5c8ed15e] + LinearOperators v2.11.0
  [89398ba2] + LocalRegistry v0.5.7
  [2ab3a3ac] + LogExpFunctions v0.3.29
  [bdcacae8] + LoopVectorization v0.12.173
  [898213cb] + LowRankApprox v0.5.5
  [e65ccdef] + LowRankMatrices v1.0.2
⌅ [b2108857] + Lux v1.4.0
  [bb33d45b] + LuxCore v1.4.2
  [82251201] + LuxLib v1.13.0
⌃ [7e8f7934] + MLDataDevices v1.13.0
  [1914dd2f] + MacroTools v0.5.16
  [d125e4d3] + ManualMemory v0.1.8
  [128add7d] + MicroCollections v0.2.0
  [e1d29d7a] + Missings v1.2.0
  [102ac46a] + MultivariatePolynomials v0.5.13
  [d8a4904e] + MutableArithmetics v1.6.7
  [d41bc354] + NLSolversBase v7.10.0
  [872c559c] + NNlib v0.9.31
  [77ba4419] + NaNMath v1.1.3
  [d9ec5142] + NamedTupleTools v0.14.3
  [2fcf5ba9] + NeighbourLists v0.5.10
  [4d1e1d77] + Nullables v1.0.0
  [6fd5a793] + Octavian v0.3.29
  [6fe1bfb0] + OffsetArrays v1.17.0
  [429524aa] + Optim v1.13.2
⌅ [3bd65402] + Optimisers v0.3.4
  [bac558e1] + OrderedCollections v1.8.1
  [2dcacdae] + ParallelDataTransfer v0.5.1
  [d96e819e] + Parameters v0.12.3
  [69de0a69] + Parsers v2.8.3
  [793d2195] + PartialWaveFunctions v0.2.0
  [7b2266bf] + PeriodicTable v1.2.1
  [1d0040c9] + PolyesterWeave v0.2.2
  [03c4bcba] + Polynomials4ML v0.5.3
  [2dfb63ee] + PooledArrays v1.4.3
  [85a6dd25] + PositiveFactorizations v0.2.4
⌅ [aea7be01] + PrecompileTools v1.2.1
  [21216c6a] + Preferences v1.5.0
⌅ [08abe8d2] + PrettyTables v2.4.0
  [92933f4c] + ProgressMeter v1.11.0
  [43287f4e] + PtrArrays v1.3.0
  [29d2ae51] + QRupdate v1.0.1
  [1fd47b50] + QuadGK v2.11.2
  [94ee1d12] + Quaternions v0.7.6
  [c84ed2f1] + Ratios v0.4.5
  [c1ae055f] + RealDot v0.1.0
  [3cdcf5f2] + RecipesBase v1.3.4
  [189a3867] + Reexport v1.2.2
  [42d2dcc6] + Referenceables v0.1.3
  [2792f1a3] + RegistryInstances v0.1.0
  [d1eb7eb1] + RegistryTools v2.4.0
  [f07d36f2] + RepLieGroups v0.1.1
  [ae029012] + Requires v1.3.1
  [f2b01f46] + Roots v2.2.10
  [6038ab10] + Rotations v1.7.1
  [94e857df] + SIMDTypes v0.1.0
  [476501e8] + SLEEFPirates v0.6.43
  [431bcebd] + SciMLPublic v1.0.0
  [7e506255] + ScopedValues v1.5.0
  [91c51154] + SentinelArrays v1.4.8
  [efcf1570] + Setfield v1.1.2
  [a2af1166] + SortingAlgorithms v1.2.2
  [dc90abb0] + SparseInverseSubset v0.1.2
  [276daf66] + SpecialFunctions v2.6.1
  [5caf2b29] + SpheriCart v0.2.3
  [171d559e] + SplittablesBase v0.1.15
  [aedffcd0] + Static v1.3.1
  [0d7ed370] + StaticArrayInterface v1.8.0
  [90137ffa] + StaticArrays v1.9.15
  [1e83bf80] + StaticArraysCore v1.4.4
  [62e018b1] + StaticPolynomials v1.3.7
  [10745b16] + Statistics v1.11.1
  [82ae8749] + StatsAPI v1.7.1
  [2913bbd2] + StatsBase v0.34.8
  [d1fa6d79] + StrideArrays v0.1.29
  [7792a7ef] + StrideArraysCore v0.5.8
  [69024149] + StringEncodings v0.3.7
  [892a3eda] + StringManipulation v0.4.1
⌅ [09ab397b] + StructArrays v0.6.21
  [3783bdb8] + TableTraits v1.0.1
  [bd369af6] + Tables v1.12.1
  [ed4db957] + TaskLocalValues v0.1.3
  [b718987f] + TextWrap v1.0.2
  [24d252fe] + ThreadedScans v0.1.0
  [8290d209] + ThreadingUtilities v0.5.5
  [a759f4b9] + TimerOutputs v0.5.29
  [3bb67fe8] + TranscodingStreams v0.11.3
  [28d57a85] + Transducers v0.4.85
  [3a884ed6] + UnPack v1.0.2
  [1986cc42] + Unitful v1.25.1
  [a7773ee8] + UnitfulAtomic v1.0.0
  [c4a57d5a] + UnsafeArrays v1.0.8
  [013be700] + UnsafeAtomics v0.3.0
  [3d5dd08c] + VectorizationBase v0.21.72
  [33b4df10] + VectorizedRNG v0.2.25
  [3b853605] + VectorizedStatistics v0.5.11
  [d49dbf32] + WeightInitializers v1.2.2
  [87c4ff3e] + WignerD v0.1.4
  [fb1aa66a] + WithAlloc v0.1.1
  [efce3f68] + WoodburyMatrices v1.0.0
  [ddb6d928] + YAML v0.4.16
  [49080126] + ZipArchives v2.6.0
⌅ [e88e6eb3] + Zygote v0.6.77
  [700de1a5] + ZygoteRules v0.2.7
  [f5851436] + FFTW_jll v3.3.11+0
  [1d5cc7b8] + IntelOpenMP_jll v2025.2.0+0
  [dad2f222] + LLVMExtra_jll v0.0.38+0
  [94ce4f54] + Libiconv_jll v1.18.0+0
  [856f044c] + MKL_jll v2025.2.0+0
  [efe28fd5] + OpenSpecFun_jll v0.5.6+0
  [6ecdc6fc] + extxyz_jll v0.1.3+0
  [cdc7adba] + libcleri_jll v0.12.1+3
  [1317d2d5] + oneTBB_jll v2022.0.0+1
  [0dad84c5] + ArgTools v1.1.2
  [56f22d72] + Artifacts v1.11.0
  [2a0f44e3] + Base64 v1.11.0
  [ade2ca70] + Dates v1.11.0
  [8ba89e20] + Distributed v1.11.0
  [f43a241f] + Downloads v1.6.0
  [7b1f6079] + FileWatching v1.11.0
  [9fa8497b] + Future v1.11.0
  [b77e0a4c] + InteractiveUtils v1.11.0
  [4af54fe1] + LazyArtifacts v1.11.0
  [b27032c2] + LibCURL v0.6.4
  [76f85450] + LibGit2 v1.11.0
  [8f399da3] + Libdl v1.11.0
  [37e2e46d] + LinearAlgebra v1.11.0
  [56ddb016] + Logging v1.11.0
  [d6f4376e] + Markdown v1.11.0
  [a63ad114] + Mmap v1.11.0
  [ca575930] + NetworkOptions v1.2.0
  [44cfe95a] + Pkg v1.11.0
  [de0858da] + Printf v1.11.0
  [9abbd945] + Profile v1.11.0
  [9a3f8284] + Random v1.11.0
  [ea8e919c] + SHA v0.7.0
  [9e88b42a] + Serialization v1.11.0
  [1a1011a3] + SharedArrays v1.11.0
  [6462fe0b] + Sockets v1.11.0
  [2f01184e] + SparseArrays v1.11.0
  [4607b0f0] + SuiteSparse
  [fa267f1f] + TOML v1.0.3
  [a4e569a6] + Tar v1.10.0
  [8dfed614] + Test v1.11.0
  [cf7118a7] + UUIDs v1.11.0
  [4ec0a83e] + Unicode v1.11.0
  [e66e0078] + CompilerSupportLibraries_jll v1.1.1+0
  [deac9b47] + LibCURL_jll v8.6.0+0
  [e37daf67] + LibGit2_jll v1.7.2+0
  [29816b5a] + LibSSH2_jll v1.11.0+1
  [c8ffd9c3] + MbedTLS_jll v2.28.6+0
  [14a3606d] + MozillaCACerts_jll v2023.12.12
  [4536629a] + OpenBLAS_jll v0.3.27+1
  [05823500] + OpenLibm_jll v0.8.5+0
  [efcefdf7] + PCRE2_jll v10.42.0+1
  [bea87d4a] + SuiteSparse_jll v7.7.0+0
  [83775a58] + Zlib_jll v1.2.13+1
  [8e850b90] + libblastrampoline_jll v5.11.0+0
  [8e850ede] + nghttp2_jll v1.59.0+0
  [3f19e933] + p7zip_jll v17.4.0+2
        Info Packages marked with ⌃ and ⌅ have new versions available. Those with ⌃ may be upgradable, but those with ⌅ are restricted by compatibility constraints from upgrading. To see why use `status --outdated -m`
/tmp/jl_PE5ynM1sN6
[ Info: Load parameter file
[ Info: result_folder not specified, create result folder at example_paramsresults
[ Info: result storing at example_params_results
[ Info: Construct ACEmodel of type ACE1
[ Info: Load datasets
┌───────────────┬──────────┬───────┬────┬─────┬─────━
│          Type │ #Configs │ #Envs │ #E │  #F │  #V │
├───────────────┼──────────┼───────┼────┼─────┼─────┤
│ isolated_atom │        1 │     1 │  1 │   3 │   0 │
│           dia │       25 │    50 │ 25 │ 150 │ 150 │
│            bt │       25 │    50 │ 25 │ 150 │ 150 │
│           liq │        2 │   128 │  2 │ 384 │  12 │
├───────────────┼──────────┼───────┼────┼─────┼─────┤
│         total │       53 │   229 │ 53 │ 687 │ 312 │
│       missing │        0 │     0 │  0 │   0 │   6 │
└───────────────┴──────────┴───────┴────┴─────┴─────┘
[ Info: Assembling linear problem.
[ Info:   - Creating feature matrix with size (1052, 77).
[ Info:   - Beginning assembly with processor count:  1.
Progress:   4%|█▌                                       |  ETA: 0:07:37[KProgress:  11%|████▋                                    |  ETA: 0:02:40[KProgress:  30%|████████████▁                            |  ETA: 0:00:57[KProgress:  49%|████████████████████▁                    |  ETA: 0:00:30[KProgress:  53%|█████████████████████▋                   |  ETA: 0:00:27[KProgress:  58%|████████████████████████                 |  ETA: 0:00:22[KProgress:  64%|██████████████████████████▁              |  ETA: 0:00:18[KProgress:  83%|██████████████████████████████████       |  ETA: 0:00:08[KProgress: 100%|█████████████████████████████████████████| Time: 0:00:41[K
[ Info:   - Assembly completed.
[ Info: Assembling full weight vector.
Progress:   4%|█▌                                       |  ETA: 0:00:05[KProgress: 100%|█████████████████████████████████████████| Time: 0:00:00[K
[ Info: Entering bayesian_linear_regression_svd
┌ Info: Computing SVD of (1052, 77) matrix
│   BLAS.get_num_threads() = 1
│   BLAS.get_config() =
│    LinearAlgebra.BLAS.LBTConfig
│    Libraries: 
└    └ [ILP64] libopenblas64_.so
[ Info: SVD completed after 0.00011402685 minutes
[ Info: Beginning to maximize marginal likelihood
┌ Warning: x_tol is deprecated. Use x_abstol or x_reltol instead. The provided value (1.0e-8) will be used as x_abstol.
└ @ Optim ~/.julia/packages/Optim/7krni/src/types.jl:110
Iter     Function value   Gradient norm 
     0     1.270836e+05     1.464454e+05
 * time: 0.03163790702819824
     1     1.351083e+04     7.081152e-03
 * time: 1.2412497997283936
     2     1.331870e+04     8.510528e-03
 * time: 1.2414898872375488
     3     1.101250e+04     7.883015e-02
 * time: 1.241581916809082
     4     9.295982e+03     4.225325e-01
 * time: 1.2416999340057373
     5     7.742354e+03     1.981476e+00
 * time: 1.241769790649414
     6     7.431386e+03     2.707360e+00
 * time: 1.241851806640625
     7     6.005797e+03     1.140956e+01
 * time: 1.2419219017028809
     8     4.621387e+03     4.494620e+01
 * time: 1.242002010345459
     9     3.766839e+03     1.442050e+01
 * time: 1.242130994796753
    10     3.765117e+03     1.727328e+00
 * time: 1.242201805114746
    11     3.765095e+03     4.564010e-02
 * time: 1.242248773574829
    12     3.745083e+03     4.249401e+01
 * time: 1.2423789501190186
    13     3.585893e+03     1.429322e+02
 * time: 1.2425618171691895
    14     3.546013e+03     1.340835e+02
 * time: 1.2426879405975342
    15     3.483749e+03     6.183842e+01
 * time: 1.2427499294281006
    16     3.445969e+03     3.435997e+01
 * time: 1.2427978515625
    17     3.445312e+03     3.112356e+01
 * time: 1.242908000946045
    18     3.438983e+03     6.688316e-01
 * time: 1.242973804473877
    19     3.438943e+03     2.315834e-01
 * time: 1.2430229187011719
    20     3.438943e+03     2.826998e-04
 * time: 1.2430839538574219
    21     3.438943e+03     8.282673e-06
 * time: 1.2431459426879883
    22     3.438943e+03     3.815119e-11
 * time: 1.2432069778442383
    23     3.438943e+03     8.535310e-18
 * time: 1.2432677745819092
┌ Info: Optimization complete
│   Results =
│     * Status: success
│    
│     * Candidate solution
│        Final objective value:     3.438943e+03
│    
│     * Found with
│        Algorithm:     L-BFGS
│    
│     * Convergence measures
│        |x - x'|               = 1.83e-10 ≤ 1.0e-08
│        |x - x'|/|x'|          = 6.19e-13 ≰ 0.0e+00
│        |f(x) - f(x')|         = 0.00e+00 ≤ 0.0e+00
│        |f(x) - f(x')|/|f(x')| = 0.00e+00 ≤ 0.0e+00
│        |g(x)|                 = 8.54e-18 ≰ 0.0e+00
│    
│     * Work counters
│        Seconds run:   1  (vs limit Inf)
│        Iterations:    23
│        f(x) calls:    119
│        ∇f(x) calls:   119
└    
[ Info: evaluating errors
[ Info: RMSE Table
┌───────────────┬────────────┬──────────┬──────────━
│          Type │    E [meV] │ F [eV/A] │  V [meV] │
├───────────────┼────────────┼──────────┼──────────┤
│ isolated_atom │ 158544.968 │    0.000 │    0.000 │
│           dia │     46.830 │    0.827 │  637.354 │
│           liq │     48.204 │    1.995 │  519.752 │
│            bt │    664.928 │    1.544 │ 2683.508 │
├───────────────┼────────────┼──────────┼──────────┤
│           set │  21782.640 │    1.702 │ 1915.153 │
└───────────────┴────────────┴──────────┴──────────┘
[ Info: MAE Table
┌───────────────┬────────────┬──────────┬──────────━
│          Type │    E [meV] │ F [eV/A] │  V [meV] │
├───────────────┼────────────┼──────────┼──────────┤
│ isolated_atom │ 158544.968 │    0.000 │    0.000 │
│           dia │     40.725 │    0.605 │  418.385 │
│           liq │     41.427 │    1.568 │  396.962 │
│            bt │    613.296 │    1.119 │ 1832.393 │
├───────────────┼────────────┼──────────┼──────────┤
│           set │   3301.478 │    1.253 │ 1097.373 │
└───────────────┴────────────┴──────────┴──────────┘
[ Info: RMSE Table
┌───────────────┬────────────┬──────────┬──────────━
│          Type │    E [meV] │ F [eV/A] │  V [meV] │
├───────────────┼────────────┼──────────┼──────────┤
│ isolated_atom │ 158544.968 │    0.000 │    0.000 │
│           dia │     46.830 │    0.827 │  637.354 │
│           liq │     48.204 │    1.995 │  519.752 │
│            bt │    664.928 │    1.544 │ 2683.508 │
├───────────────┼────────────┼──────────┼──────────┤
│           set │  21782.640 │    1.702 │ 1915.153 │
└───────────────┴────────────┴──────────┴──────────┘
[ Info: MAE Table
┌───────────────┬────────────┬──────────┬──────────━
│          Type │    E [meV] │ F [eV/A] │  V [meV] │
├───────────────┼────────────┼──────────┼──────────┤
│ isolated_atom │ 158544.968 │    0.000 │    0.000 │
│           dia │     40.725 │    0.605 │  418.385 │
│           liq │     41.427 │    1.568 │  396.962 │
│            bt │    613.296 │    1.119 │ 1832.393 │
├───────────────┼────────────┼──────────┼──────────┤
│           set │   3301.478 │    1.253 │ 1097.373 │
└───────────────┴────────────┴──────────┴──────────┘
[ Info: saving project
[ Info: Results saved to file: example_params_results/results.json
[ Info: Load the results
[ Info: Rebuild and check Project and Manifest file 
[ Info: Clean up temporary project
[ Info: Check that runfit gives the same results as a julia script
[ Info: TODO: 
[ Info: saving project
[ Info: Results saved to file: /tmp/jl_bUXiXatqNE.json
++++++++++[ Info:  ============== Testing for ACEpotentials #208 ================
[ Info:  On Julia 1.9 some energy computations were inconsistent. 
maxdiff = 4.058620106661692e-11 eV
[ Info:  ============================================================
[ Info:  ============== Testing for no Eref bug ====================
Test Passed
[ Info:  ============================================================
[ Info: -------- Test Fast ACE evaluator ----------
[ Info: construct a Si model and fit parameters using BLR
┌───────────────┬──────────┬───────┬────┬─────┬─────━
│          Type │ #Configs │ #Envs │ #E │  #F │  #V │
├───────────────┼──────────┼───────┼────┼─────┼─────┤
│ isolated_atom │        1 │     1 │  1 │   3 │   0 │
│           dia │       25 │    50 │ 25 │ 150 │ 150 │
│            bt │       25 │    50 │ 25 │ 150 │ 150 │
│           liq │        2 │   128 │  2 │ 384 │  12 │
├───────────────┼──────────┼───────┼────┼─────┼─────┤
│         total │       53 │   229 │ 53 │ 687 │ 312 │
│       missing │        0 │     0 │  0 │   0 │   6 │
└───────────────┴──────────┴───────┴────┴─────┴─────┘
[ Info: Assembling linear problem.
[ Info:   - Creating feature matrix with size (1052, 77).
[ Info:   - Beginning assembly with processor count:  1.
Progress:   4%|█▌                                       |  ETA: 0:05:16Progress:   9%|███▉                                     |  ETA: 0:02:14Progress:  28%|███████████▋                             |  ETA: 0:00:47Progress:  47%|███████████████████▁                     |  ETA: 0:00:26Progress:  53%|█████████████████████▋                   |  ETA: 0:00:22Progress:  72%|█████████████████████████████▁           |  ETA: 0:00:11Progress:  77%|███████████████████████████████▊         |  ETA: 0:00:09Progress:  96%|███████████████████████████████████████▌ |  ETA: 0:00:01Progress: 100%|█████████████████████████████████████████| Time: 0:00:35
[ Info:   - Assembly completed.
[ Info: Assembling full weight vector.
┌ Warning: x_tol is deprecated. Use x_abstol or x_reltol instead. The provided value (1.0e-8) will be used as x_abstol.
└ @ Optim ~/.julia/packages/Optim/7krni/src/types.jl:110
Iter     Function value   Gradient norm 
     0     1.209180e+03     7.720422e+02
 * time: 0.030491113662719727
     1     8.382859e+02     6.648796e+02
 * time: 1.3355579376220703
     2     6.882793e+02     7.065878e+02
 * time: 1.3372220993041992
     3     6.606076e+02     4.831499e+02
 * time: 1.338724136352539
     4     6.277152e+02     1.830728e+02
 * time: 1.339475154876709
     5     5.839705e+02     5.992019e+02
 * time: 1.3406410217285156
     6     4.713506e+02     1.122387e+03
 * time: 1.3418059349060059
     7     3.262179e+02     1.219080e+03
 * time: 1.34293794631958
     8     2.612007e+02     6.977701e+02
 * time: 1.3440971374511719
     9     2.457200e+02     3.008602e+02
 * time: 1.3448891639709473
    10     2.361525e+02     3.546420e+02
 * time: 1.3457109928131104
    11     1.906096e+02     4.482033e+02
 * time: 1.3473200798034668
    12     1.865523e+02     1.068142e+01
 * time: 1.3484740257263184
    13     1.860906e+02     8.205156e+01
 * time: 1.3500151634216309
    14     1.859881e+02     1.724657e+00
 * time: 1.3511760234832764
    15     1.859873e+02     1.104246e-01
 * time: 1.3523361682891846
    16     1.859873e+02     6.396277e-05
 * time: 1.35349702835083
    17     1.859873e+02     1.170863e-06
 * time: 1.3546371459960938
    18     1.859873e+02     8.905912e-08
 * time: 1.355816125869751
    19     1.859873e+02     3.087310e-07
 * time: 1.356977939605713
 * Status: success

 * Candidate solution
    Final objective value:     1.859873e+02

 * Found with
    Algorithm:     L-BFGS

 * Convergence measures
    |x - x'|               = 5.26e-09 ≤ 1.0e-08
    |x - x'|/|x'|          = 1.53e-10 ≰ 0.0e+00
    |f(x) - f(x')|         = 3.96e-08 ≰ 0.0e+00
    |f(x) - f(x')|/|f(x')| = 2.13e-10 ≰ 0.0e+00
    |g(x)|                 = 3.09e-07 ≰ 0.0e+00

 * Work counters
    Seconds run:   1  (vs limit Inf)
    Iterations:    19
    f(x) calls:    77
    ∇f(x) calls:   77

++++++++++++++++++++++++++++++++++++++++
[ Info: confirm that predictions are identical
++++++++++++++++++++++++++++++++++++++++++++++++++++++++++++
[ Info: construct a TiAl model and set random parameters
[ Info: convert to UF_ACE format
[ Info: confirm that predictions are identical on a site
++++++++++++++++++++++++++++++++++++++++
[ Info: confirm that predictions are identical on systems
++++++++++++++++++++++++++++++++++++++++++++++++++++++++++++
Test Summary:                   | Pass  Error  Total     Time
ACEpotentials.jl                |  259      6    265  4m17.4s
  Models                        |   45      5     50    11.5s
    Vref                        |   42            42     4.5s
    Radial Envelopes            |                  0     0.0s
    Radial Transforms           |    3             3     3.5s
    Rnlrzz Basis                |           1      1     1.3s
    Pair Basis                  |           1      1     0.2s
    ACE Model                   |           1      1     0.2s
    ACE Calculator              |           1      1     0.2s
    Committees                  |           1      1     1.5s
  Test silicon                  |           1      1     0.2s
  Test recomputation of weights |    2             2    10.3s
  Test JSON interface           |                  0  2m03.2s
  Test IO                       |   10            10    34.5s
  Weird bugs                    |    2             2     9.9s
  Fast Evaluator                |  200           200  1m07.7s
ERROR: LoadError: Some tests did not pass: 259 passed, 0 failed, 6 errored, 0 broken.
in expression starting at /home/eng/essswb/ace-potentials-julia-1.2/ACEpotentials.jl/test/runtests.jl:3
